[
  {
    "name": "Power Ring",
    "type": "Accessory",
    "effects": {
      "STR": 2
    },
    "price": 1500,
    "lore": "Resized twice: once for a quarry foreman, once for the man who beat him."
  },
  {
    "name": "Magic Ring",
    "type": "Accessory",
    "effects": {
      "MAG": 2
    },
    "price": 1500,
    "lore": "Ansel, the ring hums while I study. Tell me that's normal. Love, Mira."
  },
  {
    "name": "Speed Ring",
    "type": "Accessory",
    "effects": {
      "SPD": 2
    },
    "price": 2000,
    "lore": "Won at a duel the witnesses called mercifully short."
  },
  {
    "name": "Shield Ring",
    "type": "Accessory",
    "effects": {
      "DEF": 2
    },
    "price": 1500,
    "lore": "Cast from a shield-boss that outlived the three men who carried it."
  },
  {
    "name": "Barrier Ring",
    "type": "Accessory",
    "effects": {
      "RES": 2
    },
    "price": 1500,
    "lore": "Inside the band, in a child's letters: NO FIRE ON PAPA."
  },
  {
    "name": "Skill Ring",
    "type": "Accessory",
    "effects": {
      "SKL": 3
    },
    "price": 1500,
    "lore": "Pawn ticket still tied on: one ring, fletcher's, redeem by spring. Unredeemed."
  },
  {
    "name": "Goddess Icon",
    "type": "Accessory",
    "effects": {
      "LCK": 8
    },
    "price": 1000,
    "lore": "Thumbed blank by the dying. The goddess's name was not forgotten; it was spent."
  },
  {
    "name": "Seraph Robe",
    "type": "Accessory",
    "effects": {
      "HP": 5
    },
    "price": 2000,
    "lore": "Temple sisters sewed it for a son they never had. It fits whoever needs it."
  },
  {
    "name": "Boots",
    "type": "Accessory",
    "effects": {
      "MOV": 1
    },
    "price": 3000,
    "lore": "Resoled four times. The courier inside them was never caught, or paid."
  },
  {
    "name": "Delphi Shield",
    "type": "Accessory",
    "effects": {
      "DEF": 1,
      "RES": 1
    },
    "combatEffects": {
      "negateFlierWeakness": true
    },
    "price": 2500,
    "lore": "Sky legion issue. The archers have a word for riders without one: supper."
  },
  {
    "name": "Veteran's Crest",
    "type": "Accessory",
    "effects": {
      "STR": 1,
      "SPD": 1,
      "DEF": 1
    },
    "price": 2000,
    "lore": "Awarded after twenty battles. Awarded: 61. Still worn at discharge: 4."
  },
  {
    "name": "Wrath Band",
    "type": "Accessory",
    "effects": {},
    "combatEffects": {
      "critBonus": 15,
      "condition": "below50"
    },
    "price": 2000,
    "lore": "The berserk school's leash, worn backward: it loosens only once you bleed."
  },
  {
    "name": "Counter Seal",
    "type": "Accessory",
    "effects": {},
    "combatEffects": {
      "preventEnemyDouble": true
    },
    "price": 2500,
    "lore": "Pressed in the wax: ONE AT A TIME, GENTLEMEN. The dueling halls' first rule."
  },
  {
    "name": "Pursuit Ring",
    "type": "Accessory",
    "legendary": true,
    "effects": {},
    "combatEffects": {
      "doubleThresholdReduction": 2
    },
    "price": 4000,
    "lore": "Hunter's saying: the hare is faster, but the hare is also more tired."
  },
  {
    "name": "Nullify Ring",
    "type": "Accessory",
    "effects": {},
    "combatEffects": {
      "negateEffectiveness": true
    },
    "price": 2500,
    "lore": "Engraved with every slayer-rune, each one scored out by the same angry hand."
  },
  {
    "name": "Life Ring",
    "type": "Accessory",
    "effects": {},
    "combatEffects": {
      "atkBonus": 2,
      "defBonus": 2,
      "condition": "above75"
    },
    "price": 2000,
    "lore": "Favors the unscathed. Its owners tended to be either very good or very new."
  },
  {
    "name": "Forest Charm",
    "type": "Accessory",
    "effects": {},
    "combatEffects": {
      "avoidBonus": 10,
      "defBonus": 2,
      "condition": "on_forest"
    },
    "price": 1200,
    "lore": "Plaited by a warden's daughter from birch and hair. The trees know her knot."
  },
  {
    "name": "Blood Gem",
    "type": "Accessory",
    "effects": {},
    "combatEffects": {
      "weaponArtCostReduction": 5
    },
    "price": 2500,
    "lore": "Eases an art's blood-price. The gem-cutter's price, it does not ease at all."
  },
  {
    "name": "Vampire's Bloodshard",
    "type": "Accessory",
    "effects": {},
    "combatEffects": {
      "perHitHeal": 2
    },
    "price": 2000,
    "lore": "Chipped from something dug up in the fens. It was still warm. It still is."
  },
  {
    "name": "Soothing Stone",
    "type": "Accessory",
    "effects": {},
    "combatEffects": {
      "turnStartHealPercent": 20
    },
    "turnStartEffects": {
      "healSelfPercent": 20
    },
    "price": 2000,
    "lore": "A river stone his mother warmed for his cot. It never quite cooled again."
  },
  {
    "name": "Phoenix Brooch",
    "type": "Accessory",
    "effects": {},
    "combatEffects": {
      "phoenixBrooch": true,
      "phoenixHeal": 10,
      "phoenixThreshold": 0.25
    },
    "price": 2500,
    "lore": "His wife pinned it on him at the gate. Twice he fell, and twice it heard her."
  },
  {
    "name": "Recoil Guard",
    "type": "Accessory",
    "effects": {},
    "combatEffects": {
      "weaponArtDefBuff": true,
      "buffDEF": 3,
      "buffRES": 3
    },
    "price": 2000,
    "lore": "Strap it tight. Swing big. Then stand there and take it like it was your idea."
  },
  {
    "name": "Bounty Hunter's Mark",
    "type": "Accessory",
    "effects": {},
    "combatEffects": {
      "goldPerKill": 300
    },
    "price": 2000,
    "lore": "Guild brand, notched per head. The guild pays; the guild never asks whose."
  },
  {
    "name": "Moontide Amulet",
    "type": "Accessory",
    "effects": {},
    "combatEffects": {
      "moontide": true
    },
    "price": 1500,
    "lore": "Tide-silver. Some nights it sings, some it sulks; its owner learned to count."
  },
  {
    "name": "Gambler's Coin",
    "type": "Accessory",
    "effects": {},
    "combatEffects": {
      "gambler": {
        "winChance": 0.5,
        "winAtkBonus": 8,
        "lossAtkPenalty": -3
      }
    },
    "price": 1500,
    "lore": "'Heads or tails?' 'Yes.' Last words of its previous owner, more or less."
  },
  {
    "name": "Vanguard Crest",
    "type": "Accessory",
    "effects": {},
    "combatEffects": {
      "atkBonus": 4,
      "condition": "no_ally_within_2"
    },
    "price": 2000,
    "lore": "Struck for those who held ground alone. Most are presented to the family."
  },
  {
    "name": "Diamond Medallion",
    "type": "Accessory",
    "effects": {},
    "combatEffects": {
      "defBonus": 3,
      "resBonus": 3,
      "condition": "enemies_nearby_2plus"
    },
    "price": 2000,
    "lore": "Caravan guards swear by it: the more knives around you, the harder it shines."
  },
  {
    "name": "Hunter's Cloak",
    "type": "Accessory",
    "effects": {},
    "combatEffects": {
      "hitBonus": 20,
      "critBonus": 10,
      "condition": "on_forest_or_mountain"
    },
    "price": 1500,
    "lore": "Deep-wood families hand it down with the bow. Stand still in it and be a tree."
  },
  {
    "name": "Duelist's Glove",
    "type": "Accessory",
    "effects": {},
    "combatEffects": {
      "hitBonus": 10,
      "avoidBonus": 10,
      "critBonus": 5,
      "condition": "no_ally_within_2"
    },
    "price": 2500,
    "lore": "Dueling hall etiquette: one glove thrown, one opponent, no seconds, no help."
  },
  {
    "name": "Warding Charm",
    "type": "Accessory",
    "effects": {},
    "combatEffects": {
      "statusImmunity": true
    },
    "price": 2000,
    "lore": "A novice's first ward, knotted too tight to undo. Hexes can't find the ends."
  },
  {
    "name": "Mentor's Band",
    "type": "Accessory",
    "legendary": true,
    "effects": {},
    "combatEffects": {
      "xpShare": 0.5
    },
    "price": 2500,
    "lore": "Old Hessa taught forty recruits in it. Thirty-one lived. She called it a good year."
  },
  {
    "name": "Mercury Sandals",
    "type": "Accessory",
    "legendary": true,
    "effects": {},
    "combatEffects": {
      "moveTypeOverride": "Flying"
    },
    "price": 5000,
    "lore": "Winged heels out of an old myth. The myth leaves out the archers."
  },
  {
    "name": "Phalanx Band",
    "type": "Accessory",
    "legendary": true,
    "effects": {},
    "combatEffects": {
      "defBonus": 2,
      "resBonus": 2,
      "hitBonus": 10,
      "condition": "adjacent_ally"
    },
    "price": 3500,
    "lore": "Issued in pairs. If you find one alone, don't ask the quartermaster why."
  },
  {
    "name": "Gemini Ring",
    "type": "Accessory",
    "effects": {},
    "combatEffects": {
      "gemini": {
        "bonus": 2
      }
    },
    "price": 2000,
    "lore": "Twin bands from one ingot. Each knows where the other is, and leans that way."
  },
  {
    "name": "Warden's Buckler",
    "type": "Accessory",
    "effects": {},
    "combatEffects": {
      "firstHitWard": true
    },
    "price": 2500,
    "lore": "Gate wardens catch the first blow on it. The second they are paid to take."
  },
  {
    "name": "Briar Cloak",
    "type": "Accessory",
    "effects": {},
    "combatEffects": {
      "meleeReflect": 5
    },
    "price": 1500,
    "lore": "Woven through with blackthorn. Few strike its wearer twice."
  },
  {
    "name": "Anchor Stone",
    "type": "Accessory",
    "effects": {
      "HP": 5,
      "MOV": -1
    },
    "combatEffects": {
      "atkBonus": 2,
      "anchored": true
    },
    "price": 2000,
    "lore": "A ship's anchor-weight on a cord. Heavy to carry, heavier to move."
  },
  {
    "name": "Grudge Locket",
    "type": "Accessory",
    "effects": {},
    "combatEffects": {
      "grudgeAtk": 2
    },
    "price": 1500,
    "lore": "Each name scratched inside it makes the clasp harder to close."
  },
  {
    "name": "Galeforce Charm",
    "type": "Accessory",
    "legendary": true,
    "effects": {},
    "combatEffects": {